{
  "version": "1.0.0",
  "updated": "2026-10-21",
  "disclaimer": "Rules are evidence-weighted defaults, not laws. Labels produced from them are judgements about a transcript's words, not proof that a technique caused a video's performance. Timings marked profile_overridable are replaced by the niche pattern profile once the user's own outlier evidence exists. Sources: docs/research/*.md.",
  "evidence_scale": {
    "official": "Platform or API provider documentation.",
    "strong": "Peer-reviewed and replicated, or a large field dataset.",
    "moderate": "One solid peer-reviewed study, or strong research from outside short video.",
    "weak": "Real research, but applying it to short video is our inference.",
    "pack": "Guidance from the vendored skill packs (author practice; sometimes measured, mostly not).",
    "lore": "Creator claims with no controlled evidence."
  },
  "rules": [
    {
      "id": "hook-first-line-3s",
      "type": "hook-placement",
      "rule": "The opening spoken line opens a specific gap or names a stake and finishes inside the first 3 seconds. No greeting, intro or 'in this video'.",
      "timing": { "mode": "seconds", "from": 0, "to": 3, "formats": ["shorts", "reels", "long"], "min_count": 1, "max_count": 1, "note": "beats.py HOOK_WINDOW = 3.0 s." },
      "mechanism": "Information-gap curiosity (Loewenstein) and the swipe decision; Meta models the probability of a < 3 s watch.",
      "evidence": [
        { "url": "https://transparency.meta.com/features/explaining-ranking/ig-reels-chaining/", "strength": "official", "note": "Reels ranking predicts likelihood of watching less than three seconds." },
        { "url": "https://pubmed.ncbi.nlm.nih.gov/19619181/", "strength": "strong", "note": "Kang et al. 2009: curiosity engages reward circuitry and increases effort to get answers." },
        { "url": "repo:.claude/skills/ig-reel/beats.py", "strength": "pack", "note": "Flags a hook beat running past 3 s." }
      ],
      "how_to_detect": {
        "method": "regex+llm",
        "description": "Take transcript words with start < 3.0 s. Fail on greeting/preamble patterns; ask the LLM whether those words open a specific, unanswered gap or stake.",
        "patterns": ["(?i)^\\s*(hey|hi|hello|what'?s up|welcome)\\b", "(?i)\\bin (this|today'?s) (video|reel)\\b", "(?i)\\bbefore we (get started|begin)\\b"],
        "llm_question": "Do the words spoken before 3.0 s open a specific question or stake that the viewer cannot close without watching on? Answer yes/no and quote the gap."
      },
      "how_to_stage_in_stickman": "Clip 1 [0-3s] starts mid-action: the figure is already lunging for, catching or recoiling from an oversized prop. A 2-5 word hook card (post-production) sits in the safe zone and does not repeat the spoken words.",
      "misuse": "A gap the video never closes (clickbait).",
      "arc_stage": "golden-hook",
      "severity": "must"
    },
    {
      "id": "hook-jobs-by-15s-long",
      "type": "hook-placement",
      "rule": "In long-form, the hook's three jobs are done by 15 s: confirm the title's promise, open the question, and prove the payoff exists. Protect the 30 s Intro metric.",
      "timing": { "mode": "seconds", "from": 0, "to": 15, "formats": ["long"], "min_count": 1, "max_count": 1 },
      "mechanism": "Title/thumbnail promise confirmation reduces early abandonment; YouTube reports the share still watching after 30 s.",
      "evidence": [
        { "url": "https://support.google.com/youtube/answer/9314415?hl=en", "strength": "official", "note": "Intro key moment = audience still watching after 30 s; align thumbnail and title with the opening." },
        { "url": "repo:.claude/skills/yt-script/SKILL.md", "strength": "pack", "note": "The first 15 seconds is the whole job." }
      ],
      "how_to_detect": {
        "method": "llm",
        "description": "Compare the title with transcript text before 15 s.",
        "llm_question": "Before 15 s, does the narration (a) restate the title's promise, (b) open a question, and (c) show or promise concrete proof of the payoff? Answer each yes/no with a quote."
      },
      "how_to_stage_in_stickman": "Clips 1-2 show the promised artifact briefly (the finished 'machine', the full chart) before the explanation begins, then hide it again.",
      "arc_stage": "golden-hook",
      "severity": "must"
    },
    {
      "id": "stakes-line-early",
      "type": "stakes-line",
      "rule": "One line names what it costs the viewer to keep doing the current thing, with a concrete, sourced number when one exists. Short-form places it by 0:04-0:07, long-form by 0:20.",
      "timing": { "mode": "seconds", "from": 2, "to": 7, "formats": ["shorts", "reels"], "min_count": 1, "max_count": 2, "profile_overridable": true, "note": "Long-form: by 20 s (see stakes-line-long)." },
      "mechanism": "Self-relevance and possible loss make the message matter. Loss aversion is contested (Gal & Rucker 2018); naming a concrete cost is the safe version of the claim.",
      "evidence": [
        { "url": "https://papers.ssrn.com/abstract=3049660", "strength": "moderate", "note": "Gal & Rucker 2018 challenge the general loss-aversion claim; use concrete stakes rather than fear." },
        { "url": "repo:.claude/skills/ig-reel/SKILL.md", "strength": "pack", "note": "0:02-0:07 THE STAKE: why this matters to the person watching." }
      ],
      "how_to_detect": {
        "method": "regex+llm",
        "description": "Cost/loss vocabulary or a money/time figure aimed at 'you', confirmed by the LLM as a stake for the viewer.",
        "patterns": ["(?i)\\b(cost|costs|costing|lose|losing|lost|waste|wasting|paying|broke|miss out)\\b", "\\$\\s?\\d", "(?i)\\b\\d+\\s?(hours?|days?|years?|percent|%)\\b"],
        "llm_question": "Which sentence states what the viewer personally loses or pays by not acting? Give its start time, or 'none'."
      },
      "how_to_stage_in_stickman": "A concrete loss in motion: coins drain from the figure's pocket, an hourglass empties onto a pile, or a trapdoor opens under the next step. One danger accent colour, used only here and at the catch.",
      "misuse": "Invented or inflated numbers; fear-mongering in finance or health.",
      "arc_stage": "golden-hook",
      "severity": "must"
    },
    {
      "id": "stakes-line-long",
      "type": "stakes-line",
      "rule": "Long-form: the stakes line lands within the first 20 s.",
      "timing": { "mode": "seconds", "from": 0, "to": 20, "formats": ["long"], "min_count": 1, "max_count": 2, "profile_overridable": true },
      "mechanism": "Same as stakes-line-early, scaled to a longer opening.",
      "evidence": [ { "url": "repo:.claude/skills/yt-script/SKILL.md", "strength": "pack", "note": "Hook = confirm, open a question, prove the payoff; the stake is part of why the question matters." } ],
      "how_to_detect": {
        "method": "llm",
        "description": "Same as stakes-line-early, over the first 20 s.",
        "llm_question": "Which sentence before 20 s states what the viewer personally loses or pays by not acting? Give its start time, or 'none'."
      },
      "how_to_stage_in_stickman": "Same visual vocabulary as stakes-line-early, held a beat longer with a slow camera push.",
      "arc_stage": "golden-hook",
      "severity": "should"
    },
    {
      "id": "rehook-stage-boundaries",
      "type": "rehook-cadence",
      "rule": "Re-open the loop at stage boundaries with a 'but here's the catch' line that raises a new, specific question before the old one is fully closed. Defaults are about 35% and 70% of runtime, replaced by the niche profile once evidence exists.",
      "timing": { "mode": "percent", "from": 30, "to": 75, "formats": ["shorts", "reels", "long"], "min_count": 1, "max_count": 3, "profile_overridable": true, "note": "Default anchors 35% and 70%: end of Disrupting Assumptions and end of Ultimate Truth." },
      "mechanism": "Curiosity gaps plus the resumption pull for unfinished sequences (Ovsiankina). The memory-advantage version of the Zeigarnik effect does not replicate.",
      "evidence": [
        { "url": "https://ideas.repec.org/a/pal/palcom/v12y2025i1d10.1057_s41599-025-05000-w.html", "strength": "strong", "note": "Ghibellini & Meier 2025 meta-analysis: no memory advantage for unfinished tasks, but a general tendency to resume them." },
        { "url": "https://passionfru.it/mrbeast-leaked-document-81151/", "strength": "lore", "note": "Leaked (unconfirmed) MrBeast production guide on re-engagement." },
        { "url": "repo:vendor/papercut-explainer/skills/papercut-script/SKILL.md", "strength": "pack", "note": "Spine beats 'And get this' (peak) and 'Catch' (honest counterpoint)." }
      ],
      "how_to_detect": {
        "method": "regex+llm",
        "description": "Pivot phrases, confirmed by the LLM as opening a new question rather than summarising.",
        "patterns": ["(?i)\\bbut here'?s (the|where|what)\\b", "(?i)\\b(and get this|here'?s the (catch|twist|thing))\\b", "(?i)\\bbut (that'?s not|it gets)\\b", "(?i)\\b(wait|except)\\b", "(?i)\\bthe (real|actual) (reason|problem)\\b"],
        "llm_question": "List every line that raises a new unanswered question mid-video (a re-hook). Give start times. Exclude summaries."
      },
      "how_to_stage_in_stickman": "The figure reaches the 'answer' door, opens it and finds a second, stranger door behind it. Or a camera whip to a new scene with one new oversized prop. The cut carries motion (push in, impact out).",
      "misuse": "Stacking loops that are never closed; fake twists.",
      "arc_stage": "any",
      "severity": "should"
    },
    {
      "id": "rehook-long-every-3min",
      "type": "rehook-cadence",
      "rule": "Long-form: a re-engagement beat (new escalation, twist or reveal) roughly every 3 minutes.",